{
  "receipt_version": 1,
  "receipt_id": "cr-01KZX8S7R9N5J3D0W6V4T2Q1AC",
  "verdict": "PASS",
  "contract_sha256": "0f9857b4287e728c7d2f5aede5fdf5de19886f041a9355e4b0c0a21a01d593a9",
  "reviewed_at": "2026-07-17T03:43:01Z",
  "reviewer": {
    "provider": "anthropic",
    "model": "claude-opus-4-8",
    "family": "claude-4.8",
    "runtime": "claude-cli-2.1.195"
  },
  "harness_attestation": "fresh session 5bf1fbaa-0ac0-4157-9b78-0c7a98e4997d reviewed 874ac17370e84a2fd613651fbb78b4861233c7d1..b79b4a22f80415fd5e53e60b4421a56b3d18cd40; CLI JSON modelUsage attested claude-opus-4-8; subtype=success; no fallback",
  "requirement_gaps": [],
  "required_changes": [],
  "advisories": [
    "The read-only Judge could inspect files but its restricted Bash allowlist blocked independent pytest/hash execution; executable test evidence remains the mechanical authority.",
    "Manifest.contract_sha256 is recomputed at the CLI and constructor gates; memoization would be a performance-only improvement.",
    "A direct dry_run() call can preview an unreviewed manifest but cannot dispatch workers or create a RingerRunner, so it is not a dispatch bypass.",
    "The two full-suite baseline failures remain unrelated: a missing external design-reference file and a date-sensitive scoreboard assertion."
  ]
}
